{
  "schema_version": "0.1",
  "matrix_id": "toto2-ctl-c",
  "generator_config_path": "examples/configs/synthetic-toto2-controlled-target-quality.json",
  "benchmark_config_path": "examples/configs/benchmark-toto2-controlled.json",
  "dataset_output_root": "artifacts/toto2/ctl/ds",
  "benchmark_output_root": "artifacts/toto2/ctl/bench",
  "matrix_output_dir": "artifacts/toto2/ctl/m-c",
  "axes": {
    "seeds": [17, 29, 42, 73, 101],
    "horizons": [15, 30],
    "context_lengths": [64, 120]
  }
}
