{
  "schema_version": "0.1",
  "matrix_id": "benchmark-matrix-toto2-small",
  "generator_config_path": "examples/configs/synthetic-motor-toto2-matrix.json",
  "benchmark_config_path": "examples/configs/benchmark-toto2-baselines-past-only.json",
  "dataset_output_root": "artifacts/toto2/matrix-datasets",
  "benchmark_output_root": "artifacts/toto2/matrix-benchmarks",
  "matrix_output_dir": "artifacts/toto2/matrix/benchmark-matrix-toto2-small",
  "axes": {
    "seeds": [17, 42],
    "horizons": [15, 30],
    "context_lengths": [64, 120]
  }
}
